{
  "$schema": "http://json-schema.org/draft-07/schema#",
  "$ref": "#/definitions/BrowserStartRequest",
  "definitions": {
    "BrowserStartRequest": {
      "type": "object",
      "properties": {
        "command": {
          "type": "string",
          "const": "start"
        },
        "protocolVersion": {
          "$ref": "#/definitions/ProtocolVersion"
        },
        "requestId": {
          "$ref": "#/definitions/RequestId"
        },
        "sessionId": {
          "$ref": "#/definitions/RequestId"
        },
        "message": {
          "type": "string",
          "minLength": 1,
          "maxLength": 6000
        },
        "context": {
          "$ref": "#/definitions/Partial%3CPageContext%3E"
        }
      },
      "required": [
        "command",
        "protocolVersion",
        "requestId",
        "message"
      ],
      "additionalProperties": false
    },
    "ProtocolVersion": {
      "type": "string",
      "enum": [
        "1",
        "1.1"
      ],
      "description": "Core TypeScript types for Ghost Cursor SDK Matches the canonical protocol v1 specification"
    },
    "RequestId": {
      "type": "string",
      "pattern": "^[0-9a-fA-F]{8}-[0-9a-fA-F]{4}-[0-9a-fA-F]{4}-[0-9a-fA-F]{4}-[0-9a-fA-F]{12}$"
    },
    "Partial<PageContext>": {
      "type": "object",
      "properties": {
        "page": {
          "type": "string"
        },
        "values": {
          "$ref": "#/definitions/Record%3Cstring%2C(string%7Cnumber%7Cboolean)%3E"
        },
        "availableTargets": {
          "type": "array",
          "items": {
            "type": "string"
          }
        }
      },
      "additionalProperties": false
    },
    "Record<string,(string|number|boolean)>": {
      "type": "object",
      "additionalProperties": {
        "type": [
          "string",
          "number",
          "boolean"
        ]
      }
    }
  }
}
